{
  "$schema": "https://json-schema.org/draft/2020-12/schema",
  "$id": "https://velvet.dev/schemas/velvet_rope/execution_receipt.schema.json",
  "title": "Velvet Execution Receipt",
  "type": "object",
  "additionalProperties": false,
  "required": [
    "schema_version",
    "canonicalization",
    "receipt_id",
    "permit_id",
    "permit_hash",
    "dispatch_claim_record_hash",
    "pre_execution_record_hash",
    "request_hash",
    "canonical_action_hash",
    "executor",
    "outcome",
    "dispatch_attempted",
    "started_at",
    "completed_at",
    "receipt_hash",
    "signature"
  ],
  "properties": {
    "schema_version": { "const": "velvet.execution_receipt.v1" },
    "canonicalization": {
      "const": "velvet.canonical_json.v1.sha256.unsigned_payload"
    },
    "receipt_id": {
      "type": "string",
      "pattern": "^vreceipt_[0-9a-f]{32,64}$"
    },
    "permit_id": {
      "type": "string",
      "pattern": "^vpermit_[0-9a-f]{32,64}$"
    },
    "permit_hash": { "$ref": "#/$defs/hash" },
    "dispatch_claim_record_hash": { "$ref": "#/$defs/hash" },
    "pre_execution_record_hash": { "$ref": "#/$defs/hash" },
    "request_hash": { "$ref": "#/$defs/hash" },
    "canonical_action_hash": { "$ref": "#/$defs/hash" },
    "executor": { "$ref": "#/$defs/executor" },
    "outcome": {
      "enum": ["succeeded", "failed_before_dispatch", "rejected", "indeterminate"]
    },
    "dispatch_attempted": { "type": "boolean" },
    "upstream_response_hash": { "$ref": "#/$defs/hash" },
    "substrate_receipt_hash": { "$ref": "#/$defs/hash" },
    "error": { "$ref": "#/$defs/error" },
    "started_at": { "$ref": "#/$defs/timestamp" },
    "completed_at": { "$ref": "#/$defs/timestamp" },
    "receipt_hash": { "$ref": "#/$defs/hash" },
    "reason": { "type": "string", "minLength": 1 },
    "output": {
      "type": "object",
      "additionalProperties": true
    },
    "signature": {
      "allOf": [
        { "$ref": "#/$defs/signature" },
        {
          "type": "object",
          "properties": {
            "purpose": { "const": "velvet.execution_receipt.v1" }
          }
        }
      ]
    }
  },
  "$defs": {
    "hash": {
      "type": "string",
      "pattern": "^sha256:[0-9a-f]{64}$"
    },
    "timestamp": {
      "type": "string",
      "pattern": "^\\d{4}-\\d{2}-\\d{2}T\\d{2}:\\d{2}:\\d{2}(?:\\.\\d{3,9})?Z$"
    },
    "executor": {
      "type": "object",
      "additionalProperties": false,
      "required": ["executor_id", "audience", "attestation_level"],
      "properties": {
        "executor_id": { "type": "string", "minLength": 1 },
        "audience": { "type": "string", "minLength": 1 },
        "attestation_level": {
          "enum": ["gateway_observed", "substrate_attested"]
        }
      }
    },
    "error": {
      "type": "object",
      "additionalProperties": false,
      "required": ["code", "detail_hash"],
      "properties": {
        "code": { "type": "string", "minLength": 1 },
        "detail_hash": { "$ref": "#/$defs/hash" }
      }
    },
    "signature": {
      "type": "object",
      "additionalProperties": false,
      "required": [
        "schema_version",
        "provider_name",
        "algorithm",
        "key_id",
        "key_version",
        "purpose",
        "tenant_id",
        "payload_hash",
        "signature",
        "signed_at",
        "metadata"
      ],
      "properties": {
        "schema_version": { "enum": ["velvet.signature.v1", "velvet.signature.v2"] },
        "provider_name": { "type": "string", "minLength": 1 },
        "algorithm": { "type": "string", "minLength": 1 },
        "key_id": { "type": "string", "minLength": 1 },
        "key_version": { "type": "string", "minLength": 1 },
        "purpose": { "type": "string", "minLength": 1 },
        "tenant_id": { "type": "string", "minLength": 1 },
        "payload_hash": { "$ref": "#/$defs/hash" },
        "signature": { "type": "string", "minLength": 1 },
        "signed_at": { "$ref": "#/$defs/timestamp" },
        "public_verification_material": {
          "type": "object",
          "additionalProperties": true
        },
        "metadata": {
          "type": "object",
          "additionalProperties": true
        }
      }
    }
  }
}
